<?xml version="1.0" encoding="UTF-8"?>
<model
    xmlns  ="http://lt.5grupe.karolis/biosensor/model"
    xmlns:b="http://lt.5grupe.karolis/biosensor/model/bound"
    xmlns:r="http://lt.5grupe.karolis/biosensor/model/reaction"
    xmlns:s="http://lt.5grupe.karolis/biosensor/model/solver"
    xmlns:l="http://lt.5grupe.karolis/biosensor/model/listener"
    xmlns:xsi="http://www.w3.org/2001/XMLSchema-instance"
    xsi:schemaLocation="http://lt.5grupe.karolis/biosensor/model          Model.xsd
                        http://lt.5grupe.karolis/biosensor/model/bound    ModelBound.xsd
                        http://lt.5grupe.karolis/biosensor/model/reaction ModelReaction.xsd
                        http://lt.5grupe.karolis/biosensor/model/solver   ModelSolver.xsd
                        http://lt.5grupe.karolis/biosensor/model/listener ModelListener.xsd"
    coordinateSystem="Cartesian">

    <axis name="x">
        <point position="x1"/>
        <point position="x2"/>
        <point position="x3"/>
    </axis>
    <axis name="y">
        <point position="y1"/>
        <point position="y2"/>
        <point position="y3"/>
        <point position="y4"/>
    </axis>

    <substance name="S"/>
    <substance name="P"/>


    <medium name="Enzyme">
        <substance name="S" diffusion="D_Enz_S" initial="S_0"/>
        <substance name="P" diffusion="D_Enz_P" initial="P_0"/>
        <reaction xsi:type="r:MichaelisMenten"
            substrate="S"
            product="P"
            V_max="V_max"
            K_M="K_M"
        />
        <area top="y1" bottom="y2" left="x1" right="x2"/>
        <area top="y2" bottom="y3" left="x1" right="x3"/>
    </medium>
    <medium name="PerforatedMembrane">
        <area top="y1" bottom="y2" left="x2" right="x3"/>
    </medium>
    <medium name="SelectiveMembrane">
        <substance name="P" diffusion="D_Sel_P" initial="P_0"/>
        <area top="y3" bottom="y4" left="x1" right="x3"/>
    </medium>

    <bound from="x1" to="x2" at="y1">
        <substance name="S" xsi:type="b:Constant" concentration="S_Ext"/>
        <substance name="P" xsi:type="b:Constant" concentration="P_Ext"/>
    </bound>
    <bound from="y1" to="y3" at="x1">
        <substance name="S" xsi:type="b:Wall"/>
    </bound>
    <bound from="y1" to="y4" at="x1">
        <substance name="P" xsi:type="b:Wall"/>
    </bound>
    <bound from="y2" to="y3" at="x3">
        <substance name="S" xsi:type="b:Wall"/>
    </bound>
    <bound from="y2" to="y4" at="x3">
        <substance name="P" xsi:type="b:Wall"/>
    </bound>
    <bound from="x1" to="x3" at="y4">
        <substance name="P" xsi:type="b:Constant" concentration="E_0"/>
    </bound>

    <electrode name="Electrode">
        <substrate substrate="P"/>
        <position from="x1" to="x3" at="y4"/>
    </electrode>

    <symbol name="S_Ext"    value="7.5E-7"  dimension="mol/cm^2"/>
    <symbol name="P_Ext"    value="0.0"     dimension="mol/cm^2"/>
    <symbol name="S_0"      value="0.0"     dimension="mol/cm^2"/>
    <symbol name="P_0"      value="0.0"     dimension="mol/cm^2"/>
    <symbol name="E_0"      value="0.0"     dimension="mol/cm^2"/>
    <symbol name="V_max"    value="1E-8"    dimension="mol/s"/>
    <symbol name="K_M"      value="1E-8"    />
    <symbol name="D_Enz_S"  value="1E-6"    dimension="m^2/s"/>
    <symbol name="D_Enz_P"  value="1E-6"    dimension="m^2/s"/>
    <symbol name="D_Sel_P"  value="1E-6"    dimension="m^2/s"/>
    <symbol name="x1"       value="0.0"     dimension="m"/>
    <symbol name="x2"       value="1.0E-5"  dimension="m"/>
    <symbol name="x3"       value="1.01E-3" dimension="m"/>
    <symbol name="y1"       value="0.0"     dimension="m"/>
    <symbol name="y2"       value="1.0E-3"  dimension="m"/>
    <symbol name="y3"       value="1.2E-3"  dimension="m"/>
    <symbol name="y4"       value="1.4E-3"  dimension="m"/>

    <solver xsi:type="s:Implicit2D" timeStep="5E-9">
        <s:axis from="x1" to="x2" xsi:type="s:ConstantAxisPart" stepCount="200"/>
        <s:axis from="x2" to="x3" xsi:type="s:ConstantAxisPart" stepCount="200"/>
        <s:axis from="y1" to="y2" xsi:type="s:ConstantAxisPart" stepCount="200"/>
        <s:axis from="y2" to="y3" xsi:type="s:ConstantAxisPart" stepCount="200"/>
        <s:axis from="y3" to="y4" xsi:type="s:ConstantAxisPart" stepCount="200"/>
    </solver>

    <listener xsi:type="l:InvokeEvery" iterations="100">
        <l:listener xsi:type="l:StopAfter" iterations="3000"/>
    </listener>
    
</model>
